{
  "recommendation_id": "00000000-0000-4000-8000-000000000001",
  "signal_id": "00000000-0000-4000-8000-000000000002",
  "security_id": "00000000-0000-4000-8000-000000000003",
  "issuer_id": "00000000-0000-4000-8000-000000000004",
  "portfolio_run_id": "00000000-0000-4000-8000-000000000005",
  "universe_snapshot_id": "00000000-0000-4000-8000-000000000006",
  "schema_version": "1.1",
  "synthetic": true,
  "status": "published_frozen",
  "ticker": "SYNTHETIC-A",
  "strategy_version": "Rules-v1",
  "execution_model_version": "NextSessionOpen-v1",
  "label_version": "FixedHorizon-v1",
  "feature_version": "FinancialFeatures-v1",
  "model_version": "synthetic-no-model",
  "prompt_version": "synthetic-no-prompt",
  "decision_session": "SYNTHETIC-2025-01-06",
  "disclosure": "合成数据，仅用于接口验证，不代表任何真实股票或已运行策略。",
  "data_snapshot_sha256": "0000000000000000000000000000000000000000000000000000000000000000",
  "data_cutoff_at": "2025-01-06T21:45:00Z",
  "computed_at": "2025-01-06T21:50:00Z",
  "frozen_at": "2025-01-06T21:55:00Z",
  "published_at": "2025-01-06T21:55:01Z",
  "eligible_execution_at": "2025-01-07T14:30:00Z",
  "expires_at": "2025-01-07T21:00:00Z",
  "action": "BUY",
  "previous_weight": 0,
  "target_weight": 0.095,
  "score": 78.25,
  "coverage": 1,
  "calibrated_probability": null,
  "primary_horizon_sessions": 20,
  "components": [
    {"name": "F", "weight": 0.2, "score": 80, "missing_reason": null},
    {"name": "Q", "weight": 0.2, "score": 85, "missing_reason": null},
    {"name": "V", "weight": 0.15, "score": 60, "missing_reason": null},
    {"name": "C", "weight": 0.2, "score": 100, "missing_reason": null},
    {"name": "M", "weight": 0.15, "score": 75, "missing_reason": null},
    {"name": "E", "weight": 0.1, "score": 50, "missing_reason": null}
  ],
  "penalty": 0,
  "evidence_refs": ["00000000-0000-4000-8000-000000000007"],
  "reason_claims": [{"type": "rule_explanation", "text": "虚构因子加权结果78.25，仅用于检验结构、算术与时序。", "evidence_refs": ["00000000-0000-4000-8000-000000000007"]}],
  "risk_flags": ["SYNTHETIC_DATA_NOT_FOR_INVESTMENT"],
  "invalidation_conditions": ["源数据冲突或许可失效时禁止新买入。"]
}
